{"benchmark_schema":"grid.layout-benchmark/v3","cache_semantics":"First and repeated reads are reported; OS cache was not forcibly flushed.","command":"benchmarks/layout_benchmark.py --profile decision --rows 100000000 --instruments 700 --row-group-rows 100000 --generation-chunk-rows 1000000 --work-dir .benchmark-work/layout-decision --predecessor-evidence benchmarks/results/m1-layout-out-of-core-full-candidate.json --precision-evidence benchmarks/results/m1-bybit-public-inventory.json --output benchmarks/results/m1-layout-exact-decision-candidate.json --force","decision":{"eligibility":"verified exact numeric schema and at least one non-tail file at or above 80% of the requested target","eligible_layout_count":14,"owner_approval_required":true,"ranking_policy":"within each bucket count: total bytes, write seconds, aggregate scan seconds, file count, then stable layout fields","reference_rerun_shortlist":[{"bucket_count":4,"compression":"zstd","compression_level":3,"numeric_representation":"hybrid_int64_decimal","target_file_mb":32},{"bucket_count":8,"compression":"zstd","compression_level":3,"numeric_representation":"hybrid_int64_decimal","target_file_mb":16}]},"decision_inputs":{"precision_basis":{"artifact":"m1-bybit-public-inventory.json","artifact_sha256":"ae38b3536e3949282a76287192ae4af02b648fe4dc9946765c4812a78b3e286e","derived_turnover_scale":12,"max_observed_price_decimal_places":8,"max_observed_quantity_decimal_places":4,"relevant_record_count":1006,"semantics":"current public snapshot; future wider precision requires a new contract"},"predecessor":{"artifact":"m1-layout-out-of-core-full-candidate.json","artifact_sha256":"73b2dcae0e0c3d69c5e6e53a5c4d62c732eceae28219ac8eb2a271a656529e88","layout_count":54,"status":"full-matrix-insufficient-file-scale"}},"hardware":{"cpu_count_logical":12,"cpu_count_physical":6,"machine":"AMD64","platform":"Windows-10-10.0.19044-SP0","ram_bytes":16476225536},"input":{"generation_chunk_rows":1000000,"instrument_count":700,"row_count":99999900,"row_group_rows":100000,"synthetic_generator":"deterministic-v1"},"numeric_contracts":{"decimal128":{"contract_id":"grid.candle-exact-physical/v1","exact":true,"fields":{"ohlc":{"physical_type":"decimal128(38,8)","scale":8},"turnover":{"physical_type":"decimal128(38,12)","scale":12},"volume":{"physical_type":"decimal128(38,4)","scale":4}},"self_describing":true},"hybrid_int64_decimal":{"contract_id":"grid.candle-exact-physical/v1","exact":true,"fields":{"ohlc":{"field_metadata_required":true,"physical_type":"int64","scale":8,"unit":"1e-8"},"turnover":{"physical_type":"decimal128(38,12)","scale":12},"volume":{"physical_type":"decimal128(38,4)","scale":4}},"self_describing":true}},"profile":"decision","results":[{"checkpoint_reused":false,"layout":{"bucket_count":4,"compression":"zstd","compression_level":3,"numeric_representation":"hybrid_int64_decimal","target_file_mb":16},"scan":{"duckdb_single_symbol_first_seconds":"0.117324300","duckdb_single_symbol_warm_seconds":"0.118664700","duckdb_universe_month_seconds":"0.184963600","polars_single_symbol_first_seconds":"0.034577100","polars_single_symbol_warm_seconds":"0.007095600","polars_universe_month_seconds":"0.157888800","validation":{"engines_match_aggregate_values":true,"engines_match_expected_row_counts":true,"expected_single_symbol_rows":142857,"expected_universe_month_rows":31248000,"universe_window_end_ms_exclusive":1769904000000,"universe_window_start_ms":1767225600000}},"write":{"bytes":644590723,"calendar_partition_count":4,"calibration_bytes":6553993,"calibration_bytes_per_row":"6.553993000","calibration_rows":1000000,"calibration_seconds":"0.379705400","file_count":48,"generation_chunk_rows":1000000,"largest_file_bytes":17049049,"largest_file_target_ratio":"1.016202509","largest_non_tail_file_bytes":17049049,"non_tail_file_count":32,"numeric_contract_id":"grid.candle-exact-physical/v1","numeric_schema_verified":true,"peak_rss_bytes":611635200,"rows_per_file_target":2600000,"rss_baseline_bytes":74682368,"rss_peak_delta_bytes":536952832,"scratch_estimated_layout_bytes":819248306,"scratch_free_bytes_before":196055171072,"scratch_required_free_bytes":1892990130,"smallest_file_bytes":120728,"target_exercise_criterion":"at least one non-tail file is at least 80% of requested target","target_file_bytes":16777216,"target_file_exercised":true,"write_seconds":"45.444883600","writer":"pyarrow-parquet-writer"}},{"checkpoint_reused":false,"layout":{"bucket_count":4,"compression":"snappy","compression_level":null,"numeric_representation":"hybrid_int64_decimal","target_file_mb":16},"scan":{"duckdb_single_symbol_first_seconds":"0.114938500","duckdb_single_symbol_warm_seconds":"0.106791000","duckdb_universe_month_seconds":"0.164166300","polars_single_symbol_first_seconds":"0.035502900","polars_single_symbol_warm_seconds":"0.005728400","polars_universe_month_seconds":"0.145788800","validation":{"engines_match_aggregate_values":true,"engines_match_expected_row_counts":true,"expected_single_symbol_rows":142857,"expected_universe_month_rows":31248000,"universe_window_end_ms_exclusive":1769904000000,"universe_window_start_ms":1767225600000}},"write":{"bytes":965779554,"calendar_partition_count":4,"calibration_bytes":9952135,"calibration_bytes_per_row":"9.952135000","calibration_rows":1000000,"calibration_seconds":"0.349316200","file_count":68,"generation_chunk_rows":1000000,"largest_file_bytes":16925165,"largest_file_target_ratio":"1.008818448","largest_non_tail_file_bytes":16925165,"non_tail_file_count":52,"numeric_contract_id":"grid.candle-exact-physical/v1","numeric_schema_verified":true,"peak_rss_bytes":1095589888,"rows_per_file_target":1700000,"rss_baseline_bytes":1023156224,"rss_peak_delta_bytes":72433664,"scratch_estimated_layout_bytes":1244015631,"scratch_free_bytes_before":196054880256,"scratch_required_free_bytes":2317757455,"smallest_file_bytes":2625688,"target_exercise_criterion":"at least one non-tail file is at least 80% of requested target","target_file_bytes":16777216,"target_file_exercised":true,"write_seconds":"41.399041400","writer":"pyarrow-parquet-writer"}},{"checkpoint_reused":false,"layout":{"bucket_count":4,"compression":"zstd","compression_level":3,"numeric_representation":"hybrid_int64_decimal","target_file_mb":32},"scan":{"duckdb_single_symbol_first_seconds":"0.110369100","duckdb_single_symbol_warm_seconds":"0.107396300","duckdb_universe_month_seconds":"0.181581400","polars_single_symbol_first_seconds":"0.033996800","polars_single_symbol_warm_seconds":"0.005745100","polars_universe_month_seconds":"0.167000600","validation":{"engines_match_aggregate_values":true,"engines_match_expected_row_counts":true,"expected_single_symbol_rows":142857,"expected_universe_month_rows":31248000,"universe_window_end_ms_exclusive":1769904000000,"universe_window_start_ms":1767225600000}},"write":{"bytes":644547167,"calendar_partition_count":4,"calibration_bytes":6553993,"calibration_bytes_per_row":"6.553993000","calibration_rows":1000000,"calibration_seconds":"0.397706000","file_count":28,"generation_chunk_rows":1000000,"largest_file_bytes":34093934,"largest_file_target_ratio":"1.016078413","largest_non_tail_file_bytes":34093934,"non_tail_file_count":12,"numeric_contract_id":"grid.candle-exact-physical/v1","numeric_schema_verified":true,"peak_rss_bytes":1105104896,"rows_per_file_target":5200000,"rss_baseline_bytes":1040568320,"rss_peak_delta_bytes":64536576,"scratch_estimated_layout_bytes":819248306,"scratch_free_bytes_before":196054761472,"scratch_required_free_bytes":1892990130,"smallest_file_bytes":11971190,"target_exercise_criterion":"at least one non-tail file is at least 80% of requested target","target_file_bytes":33554432,"target_file_exercised":true,"write_seconds":"46.245666400","writer":"pyarrow-parquet-writer"}},{"checkpoint_reused":false,"layout":{"bucket_count":4,"compression":"snappy","compression_level":null,"numeric_representation":"hybrid_int64_decimal","target_file_mb":32},"scan":{"duckdb_single_symbol_first_seconds":"0.113511100","duckdb_single_symbol_warm_seconds":"0.102086400","duckdb_universe_month_seconds":"0.160182000","polars_single_symbol_first_seconds":"0.009429300","polars_single_symbol_warm_seconds":"0.004036000","polars_universe_month_seconds":"0.135568200","validation":{"engines_match_aggregate_values":true,"engines_match_expected_row_counts":true,"expected_single_symbol_rows":142857,"expected_universe_month_rows":31248000,"universe_window_end_ms_exclusive":1769904000000,"universe_window_start_ms":1767225600000}},"write":{"bytes":965718458,"calendar_partition_count":4,"calibration_bytes":9952135,"calibration_bytes_per_row":"9.952135000","calibration_rows":1000000,"calibration_seconds":"0.350900900","file_count":40,"generation_chunk_rows":1000000,"largest_file_bytes":33834512,"largest_file_target_ratio":"1.008347034","largest_non_tail_file_bytes":33834512,"non_tail_file_count":24,"numeric_contract_id":"grid.candle-exact-physical/v1","numeric_schema_verified":true,"peak_rss_bytes":1106481152,"rows_per_file_target":3400000,"rss_baseline_bytes":1038684160,"rss_peak_delta_bytes":67796992,"scratch_estimated_layout_bytes":1244015631,"scratch_free_bytes_before":196054577152,"scratch_required_free_bytes":2317757455,"smallest_file_bytes":2625688,"target_exercise_criterion":"at least one non-tail file is at least 80% of requested target","target_file_bytes":33554432,"target_file_exercised":true,"write_seconds":"40.737637800","writer":"pyarrow-parquet-writer"}},{"checkpoint_reused":false,"layout":{"bucket_count":8,"compression":"zstd","compression_level":3,"numeric_representation":"hybrid_int64_decimal","target_file_mb":16},"scan":{"duckdb_single_symbol_first_seconds":"0.123155900","duckdb_single_symbol_warm_seconds":"0.108967400","duckdb_universe_month_seconds":"0.188347600","polars_single_symbol_first_seconds":"0.014563100","polars_single_symbol_warm_seconds":"0.025213600","polars_universe_month_seconds":"0.157653900","validation":{"engines_match_aggregate_values":t